{
  "version": 1,
  "reise": "2026-10_holland",
  "stand": "2026-10-21T22:55+02:00",
  "meta": {
    "fahrzeug": "Tesla Model Y SR (Legacy)",
    "akku_kwh_nutzbar": 60
  },
  "stops": [
    {
      "id": "e01-herrieden",
      "typ": "ladestopp",
      "etappe_nr": 1,
      "etappe_zusatz": "(+ ~20 min Datenschutz)",
      "ort": "Herrieden",
      "supercharger": "Supercharger Herrieden",
      "lat": 49.23779,
      "lon": 10.5035,
      "zeit_ankunft": "2026-10-20T12:09+02:00",
      "zeit_abfahrt": null,
      "ladedauer_min": 13,
      "kw_min": null,
      "kw_max": 172,
      "soc_von": 19,
      "soc_bis": 90,
      "kwh": null,
      "kosten_eur": null,
      "eur_kwh": null,
      "etappen_km": 215.3,
      "wh_km": 196.2,
      "nachgeladen_km": null,
      "km_pro_min": null,
      "temperatur_c": 8.0,
      "bilder_urls": [],
      "post_url": "https://x.com/cybergigafacto1/status/2112487129691406643",
      "post_id": "2112487129691406643",
      "post_zeit": "2026-10-20T12:12+02:00",
      "weitere_posts": [
        "2112490871664812408"
      ],
      "quellen": {
        "ort": "rappy",
        "supercharger": "rappy",
        "lat": "berechnet",
        "lon": "berechnet",
        "zeit_ankunft": "rappy",
        "zeit_abfahrt": "ungeklärt",
        "ladedauer_min": "post",
        "kw_min": "ungeklärt",
        "kw_max": "screenshot",
        "soc_von": "screenshot",
        "soc_bis": "post",
        "kwh": "ungeklärt",
        "kosten_eur": "ungeklärt",
        "eur_kwh": "ungeklärt",
        "etappen_km": "screenshot",
        "wh_km": "screenshot",
        "nachgeladen_km": "ungeklärt",
        "km_pro_min": "ungeklärt",
        "temperatur_c": "wetterdaten",
        "bilder_urls": "ungeklärt",
        "etappe_nr": "berechnet",
        "etappe_fahrzeit_min": "screenshot",
        "etappe_kmh": "berechnet",
        "lader_typ": "rappy"
      },
      "schaetzung": [],
      "etappe_fahrzeit_min": 123,
      "etappe_kmh": 105.0,
      "lader_typ": "supercharger",
      "offen": [
        "zeit_abfahrt",
        "kwh",
        "kosten_eur"
      ],
      "unbestaetigt": []
    },
    {
      "id": "e02-muenchberg",
      "typ": "ladestopp",
      "etappe_nr": 2,
      "etappe_zusatz": null,
      "ort": "Münchberg",
      "supercharger": "Supercharger Münchberg",
      "lat": 50.18952,
      "lon": 11.78823,
      "zeit_ankunft": "2026-10-20T14:14+02:00",
      "zeit_abfahrt": "2026-10-20T14:25+02:00",
      "ladedauer_min": 11,
      "kw_min": 117,
      "kw_max": 171,
      "soc_von": 26,
      "soc_bis": 71,
      "kwh": 24,
      "kosten_eur": 12.11,
      "eur_kwh": 0.5,
      "etappen_km": 169.2,
      "wh_km": 191.9,
      "nachgeladen_km": 125,
      "km_pro_min": 11.4,
      "temperatur_c": 10,
      "schaetzung": [],
      "bilder_urls": [],
      "post_url": "https://x.com/cybergigafacto1/status/2112520777874510331",
      "post_id": "2112520777874510331",
      "post_zeit": "2026-10-20T14:26+02:00",
      "weitere_posts": [],
      "quellen": {
        "ort": "screenshot",
        "supercharger": "screenshot",
        "lat": "berechnet",
        "lon": "berechnet",
        "zeit_ankunft": "screenshot",
        "zeit_abfahrt": "screenshot",
        "ladedauer_min": "post",
        "kw_min": "screenshot",
        "kw_max": "screenshot",
        "soc_von": "screenshot",
        "soc_bis": "screenshot",
        "kwh": "screenshot",
        "kosten_eur": "screenshot",
        "eur_kwh": "berechnet",
        "etappen_km": "screenshot",
        "wh_km": "screenshot",
        "nachgeladen_km": "berechnet",
        "km_pro_min": "berechnet",
        "temperatur_c": "screenshot",
        "bilder_urls": "ungeklärt",
        "etappe_nr": "berechnet",
        "etappe_fahrzeit_min": "screenshot",
        "etappe_kmh": "berechnet",
        "lader_typ": "screenshot"
      },
      "etappe_fahrzeit_min": 93,
      "etappe_kmh": 109.2,
      "lader_typ": "supercharger",
      "offen": [],
      "unbestaetigt": []
    },
    {
      "id": "e03-bitterfeld",
      "typ": "ladestopp",
      "etappe_nr": 3,
      "etappe_zusatz": null,
      "ort": "Bitterfeld",
      "supercharger": "Supercharger Bitterfeld",
      "lat": 51.62355,
      "lon": 12.32395,
      "zeit_ankunft": "2026-10-20T16:04+02:00",
      "zeit_abfahrt": "2026-10-20T16:18+02:00",
      "ladedauer_min": 14,
      "kw_min": 102,
      "kw_max": 171,
      "soc_von": 12,
      "soc_bis": 71,
      "kwh": 32,
      "kosten_eur": 14.19,
      "eur_kwh": 0.44,
      "etappen_km": 177,
      "wh_km": null,
      "nachgeladen_km": null,
      "km_pro_min": null,
      "temperatur_c": 9.2,
      "schaetzung": [
        "etappen_km",
        "etappe_fahrzeit_min",
        "etappe_kmh"
      ],
      "bilder_urls": [],
      "post_url": "https://x.com/cybergigafacto1/status/2112549730462933022",
      "post_id": "2112549730462933022",
      "post_zeit": "2026-10-20T16:21+02:00",
      "weitere_posts": [],
      "quellen": {
        "ort": "rappy",
        "supercharger": "rappy",
        "lat": "berechnet",
        "lon": "berechnet",
        "zeit_ankunft": "rappy",
        "zeit_abfahrt": "rappy",
        "ladedauer_min": "post",
        "kw_min": "screenshot",
        "kw_max": "screenshot",
        "soc_von": "rappy",
        "soc_bis": "rappy",
        "kwh": "rappy",
        "kosten_eur": "rappy",
        "eur_kwh": "berechnet",
        "etappen_km": "screenshot",
        "wh_km": "ungeklärt",
        "nachgeladen_km": "ungeklärt",
        "km_pro_min": "ungeklärt",
        "temperatur_c": "wetterdaten",
        "bilder_urls": "ungeklärt",
        "etappe_nr": "berechnet",
        "etappe_fahrzeit_min": "berechnet",
        "etappe_kmh": "berechnet",
        "lader_typ": "rappy"
      },
      "etappe_fahrzeit_min": 99,
      "etappe_kmh": 107.3,
      "lader_typ": "supercharger",
      "offen": [
        "wh_km",
        "nachgeladen_km",
        "km_pro_min"
      ],
      "unbestaetigt": []
    },
    {
      "id": "e04-giga-brandenburg",
      "typ": "ladestopp",
      "etappe_nr": 4,
      "etappe_zusatz": null,
      "ort": "Giga Brandenburg (Grünheide)",
      "supercharger": null,
      "lat": 52.42343,
      "lon": 13.81324,
      "zeit_ankunft": "2026-10-20T17:59+02:00",
      "zeit_abfahrt": "2026-10-21T08:45+02:00",
      "ladedauer_min": null,
      "kw_min": null,
      "kw_max": 9,
      "soc_von": 23,
      "soc_bis": null,
      "kwh": null,
      "kosten_eur": 0,
      "eur_kwh": 0,
      "etappen_km": 173,
      "wh_km": null,
      "nachgeladen_km": null,
      "km_pro_min": null,
      "temperatur_c": 9.4,
      "schaetzung": [
        "etappen_km",
        "etappe_fahrzeit_min",
        "etappe_kmh",
        "zeit_abfahrt"
      ],
      "bilder_urls": [],
      "post_url": "https://x.com/cybergigafacto1/status/2112601189678272608",
      "post_id": "2112601189678272608",
      "post_zeit": "2026-10-20T19:45+02:00",
      "weitere_posts": [
        "2112580573063782829",
        "2112581867253715278",
        "2112793506402168973"
      ],
      "quellen": {
        "ort": "post",
        "supercharger": "ungeklärt",
        "lat": "berechnet",
        "lon": "berechnet",
        "zeit_ankunft": "rappy",
        "zeit_abfahrt": "rappy",
        "ladedauer_min": "ungeklärt",
        "kw_min": "ungeklärt",
        "kw_max": "screenshot",
        "soc_von": "screenshot",
        "soc_bis": "ungeklärt",
        "kwh": "ungeklärt",
        "kosten_eur": "post",
        "eur_kwh": "berechnet",
        "etappen_km": "berechnet",
        "wh_km": "ungeklärt",
        "nachgeladen_km": "ungeklärt",
        "km_pro_min": "ungeklärt",
        "temperatur_c": "wetterdaten",
        "bilder_urls": "ungeklärt",
        "etappe_nr": "berechnet",
        "etappe_fahrzeit_min": "berechnet",
        "etappe_kmh": "berechnet",
        "lader_typ": "rappy"
      },
      "etappe_fahrzeit_min": 101,
      "etappe_kmh": 102.8,
      "lader_typ": "destination",
      "unbestaetigt": [
        "lat",
        "lon"
      ],
      "offen": [
        "wh_km",
        "ladedauer_min",
        "soc_bis",
        "kwh"
      ]
    },
    {
      "id": "e05-netto-gruenheide",
      "typ": "stopp",
      "etappe_nr": 5,
      "etappe_zusatz": null,
      "ort": "Grünheide (Netto)",
      "supercharger": null,
      "lat": 52.42025,
      "lon": 13.82237,
      "zeit_ankunft": null,
      "zeit_abfahrt": "2026-10-21T09:34+02:00",
      "ladedauer_min": null,
      "kw_min": null,
      "kw_max": null,
      "soc_von": null,
      "soc_bis": null,
      "kwh": null,
      "kosten_eur": null,
      "eur_kwh": null,
      "etappen_km": 6.7,
      "wh_km": null,
      "nachgeladen_km": null,
      "km_pro_min": null,
      "temperatur_c": 9.5,
      "schaetzung": [
        "etappen_km",
        "zeit_abfahrt"
      ],
      "bilder_urls": [],
      "post_url": "https://x.com/cybergigafacto1/status/2112793506402168973",
      "post_id": "2112793506402168973",
      "post_zeit": "2026-10-21T08:30+02:00",
      "weitere_posts": [],
      "quellen": {
        "ort": "rappy",
        "supercharger": "rappy",
        "lat": "berechnet",
        "lon": "berechnet",
        "zeit_ankunft": "ungeklärt",
        "zeit_abfahrt": "rappy",
        "ladedauer_min": "rappy",
        "kw_min": "rappy",
        "kw_max": "rappy",
        "soc_von": "ungeklärt",
        "soc_bis": "ungeklärt",
        "kwh": "rappy",
        "kosten_eur": "rappy",
        "eur_kwh": "rappy",
        "etappen_km": "berechnet",
        "wh_km": "ungeklärt",
        "nachgeladen_km": "ungeklärt",
        "km_pro_min": "ungeklärt",
        "temperatur_c": "wetterdaten",
        "bilder_urls": "ungeklärt",
        "etappe_nr": "berechnet",
        "etappe_fahrzeit_min": "ungeklärt",
        "etappe_kmh": "ungeklärt",
        "lader_typ": "rappy"
      },
      "etappe_fahrzeit_min": null,
      "etappe_kmh": null,
      "lader_typ": null,
      "offen": [
        "zeit_ankunft",